<!ELEMENT tickets (ticket*)>

<!ELEMENT ticket (description+, fares)>
<!ATTLIST ticket type (single | day | month) #REQUIRED>

<!ELEMENT description (#PCDATA)>

<!ELEMENT fares (fare+)>

<!ELEMENT fare (A?, T2?, T3?, T4?)>
<!ATTLIST fare type CDATA #REQUIRED
price CDATA #REQUIRED>
